CompName,CompBirth,CompLiving,CompNation,CompGender,CompCald,CompFn,WorkTitle,WorkLength,WorkYear,WorkAp,WorkWp,WorkInst
Hector Berlioz,1803,N,French,M,N,N,The Return to Life,7,1831,N,N,Orchestra
Camille Saint-Saëns,1835,N,French,M,N,N,Introduction and Rondo Capriccioso ,10,1863,N,N,Orchestra
Gioachino Rossini,1792,N,Italian,M,N,N,“Una voce poco fa” from The Barber of Seville,7,1816,N,N,Orchestra
Giuseppe Verdi,1813,N,Italian,M,N,N,“D’amor sull’ali rosee” from Il Trovatore ,6,1853,N,N,Orchestra
Hubert Parry,1848,N,English,M,N,N,Blest pair of Sirens,12,1887,N,N,Orchestra
Edward Elgar,1857,N,English,M,N,N,Pomp and Circumstance March No.1,6,1901,N,N,Orchestra
Henry Wood,1869,N,English,M,N,N,Fantasia on British Sea Songs,15,1905,N,N,Orchestra
